Diálogos do Sul,dialogosdosul,405709786113933,NEWS_SITE,BR,"Revista online fundada em 2011. Herdeira da revista Cadernos do Terceiro Mundo, buscamos promover um debate sobre os principais problemas do Brasil, da América Latina e de outros países do Sul global. ",2012-04-23 14:14:16,24355,25075,2023-01-12 12:30:08 BRT,2023-01-12,12:30:08,Link,3,2,0,1,0,0,0,0,0,0,,-,0,0,0,N/A,https://www.facebook.com/405709786113933/posts/6354012601283592,"A partir de 5 de janeiro, quinta-feira, o termo passou a ser mais utilizado no Twitter, junto a vídeos que traziam uma série de códigos bolsonaristas para combinar os ataques deste domingo aos Três Poderes, em Brasília: https://bit.ly/3CCFaQm:=:https://dialogosdosul.operamundi.uol.com.br/permalink/78501 #Brasília #golpistas #terrorismo #bolsonaro -- Quer fugir dos algoritmos e receber nossos conteúdos em primeiríssima mão? Inscreva-se em nosso canal no Telegram: https://t.me/dialogosdosul",https://bit.ly/3CCFaQm,https://dialogosdosul.operamundi.uol.com.br/permalink/78501,,"""Festa da Selma"": de onde vem código usado para convocar invasão golpista em Brasília","Termo vinha sendo usado há dias pelos bolsonaristas livremente em redes sociais abertas, como o Twitter",,,,3,-8
SÁBADO,sabado,52858607943,MAGAZINE,PT,"Bem-vindo ao Facebook da SÁBADO, a sua revista semanal de Grande Informação desde 2004. Chega todas as quintas-feiras às bancas de todo o país, com o GPS. 
Site -> https://www.sabado.pt/",2009-02-23 20:54:34,323908,338094,2023-01-12 01:00:01 BRT,2023-01-12,01:00:01,Link,3,0,0,1,0,0,0,1,1,0,,-,0,0,0,N/A,https://www.facebook.com/52858607943/posts/10159301992037944,"Na descrição da ""Festa da Selma"" os organizadores avisavam que o evento ia ser violento e com confrontos com a polícia.",https://www.sabado.pt/ultima-hora/detalhe/brasil-festa-da-selma-usado-como-nome-de-codigo-para-os-ataques?previewMode=1,https://www.sabado.pt/ultima-hora/detalhe/brasil-festa-da-selma-usado-como-nome-de-codigo-para-os-ataques,,Brasil: “Festa da Selma” usado como nome de código para os ataques,Na descrição da 'Festa da Selma' os organizadores avisavam que o evento ia ser violento e com confrontos com a polícia.,,,,3,-30
Paulopes,paulopes,100063790413737,MEDIA_NEWS_COMPANY,BR,"Ateísmo, ciência, religião",2010-09-30 22:19:13,5952,5928,2023-01-09 01:41:48 BRT,2023-01-09,01:41:48,Link,2,2,0,0,0,0,0,0,0,0,,-,0,0,0,N/A,https://www.facebook.com/100063790413737/posts/626853346117674,,https://www.paulopes.com.br/2023/01/festa-da-selma-foi-codigo-de.html#.Y7uRlHbMLIU,https://www.paulopes.com.br/2023/01/festa-da-selma-foi-codigo-de.html,,'Festa da Selma' foi o código de bolsonaristas para depredações,'Festa da Selma' foi código de bolsonaristas para depredações,,,,2,-9.5
O silêncio do Justo,silenciodojusto,100063921871810,POLITICIAN,BR,O que me preocupa não é o grito dos maus. É o silêncio dos bons.,2013-10-15 16:41:35,34443,36027,2023-01-11 16:23:18 BRT,2023-01-11,16:23:18,Link,2,0,0,2,0,0,0,0,0,0,,-,0,0,0,N/A,https://www.facebook.com/100063921871810/posts/575441237929934,"#SemAnistiaPraGolpista O mapa se chama ""Viagem para Praia"". Mas, em vez de pontos turísticos, estão listadas 43 cidades no Brasil onde se podia pegar ônibus para a ""festa da Selma"", com contatos dos organizadores dos transportes. A festa se refere aos atos de 8 de janeiro, que invadiram e depredaram a sede dos três Poderes da República, em Brasília, em uma tentativa frustrada de golpe.... - Veja mais em ",https://noticias.uol.com.br/politica/ultimas-noticias/2023/01/11/mapa-online-onibus-brasilia-ato-golpista-8-janeiro-preparacao-confronto.htm?cmpid=copiaecola,https://noticias.uol.com.br/politica/ultimas-noticias/2023/01/11/mapa-online-onibus-brasilia-ato-golpista-8-janeiro-preparacao-confronto.htm,,Preparação para ato golpista teve mapa online e previu confronto violento,"O mapa se chama ""Viagem para Praia"". Mas, em vez de pontos turísticos, estão listadas 43 cidades no Brasil onde se podia pegar ônibus para a ""festa da Selma"", com contatos dos organizadores dos transportes. A festa se refere aos atos de 8 de janeiro, q",,,,2,-11
AMAST - Associação de Moradores e Amigos de Santa Teresa,amast.santateresa,101290543256528,COMMUNITY_SERVICES,BR,"Quem ama não destrói! http://twitter.com/#!/amast_santa

P.S.: Numero celular funciona apenas por whatsapp, função envio de fotos e vídeos",2010-06-13 20:12:26,14447,15723,2023-01-17 01:35:14 BRT,2023-01-17,01:35:14,Status,2,2,0,0,0,0,0,0,0,0,,-,0,0,0,N/A,https://www.facebook.com/101290543256528/posts/6095396240512565,"A ditadura da realidade Fernando Gabeira A superstição domina as mentes quando não se preocupam mais em distinguir fatos de notícias falsas 16/01/2023 00h15 Atualizado há 43 minutos ‘Abaixo a ditadura da realidade.’ Este cartaz numa charge da imprensa francesa sobre os eventos no Brasil diz muito para mim. Na semana do tsunami em Brasília, escrevi um artigo prevendo os rumos da extrema direita. Examinei as possibilidades de uma evolução como na França ou mesmo na Itália. Concluí, entretanto, que o modelo que seguia era do trumpismo americano. A influência da extrema direita americana é muito grande por aqui. Já é falta de imaginação imitar a tomada do Capitólio. Não sei o que dizer sobre copiar uma experiência claramente fracassada. Deniers, esse é o nome usado para descrever os extremistas americanos. Negacionistas como os brasileiros, que negam o aquecimento global, a pandemia, os benefícios da vacina e o resultado das eleições. Nada me parece mais claro na luta contra a ditadura da realidade do que a frase de uma das detentas em Brasília: — Estão nos dando marmitas de prisioneiros. Presa, ela se surpreendeu com a comida de preso e na penitenciária Colmeia vai achar que as janelas gradeadas parecem uma prisão e que os uniformes sugerem que não têm liberdade de usar a própria roupa. Uma das minhas interrogações sobre o movimento extremista é exatamente esta: por que se afastam tanto da realidade e, quando se dão conta dela, ficam tão revoltados? A hipótese com que trabalho, inspirada numa frase de Carl Sagan, é que a superstição domina as mentes quando não se preocupam mais em distinguir fatos de notícias falsas. Eles estão sempre esperando um milagre em 72 horas, porque acham que esse é o tempo que Cristo levou para ressuscitar. Estão sempre confiando em nebulosos órgãos internacionais, sempre analisando os gestos de Bolsonaro como mensagens cifradas: ele parou diante de pilhas num supermercado, sinal de que devemos nos preparar para a luta. Logo após as eleições, a mensagem de uma senhora dizia: — Menina, você não sabe que o Nine morreu? Estão usando um sósia no lugar dele. Sou favorável a processos transparentes, mas o que leio a respeito de Alexandre de Moraes é assustador e mostra que o ministro precisa se proteger: “Se você vier a Itaituba, vou arrancar e comer seu coração”. Se Alexandre reagir, é inevitável a resposta: mas e o direito de livre expressão? Por essas razões, estou revendo minhas análises. Minha tese é que o gênio não volta à garrafa, e este movimento dificilmente será absorvido por uma direita clássica. As categorias exclusivamente políticas não dão conta de compreendê-los. Não tenho a pretensão de explicá-los em poucas linhas. Mas, quando a realidade deixa de ser um parâmetro para a discussão, é necessário buscar outros argumentos.////////////////Nas redes, o grupo detido momentaneamente na Academia de Polícia era apresentado como um campo de concentração moderno. A cada instante, morria alguém na narrativa dos apoiadores. Num dos vídeos, um jovem diz: — Morreu uma mulher hoje. Uma senhora de passagem responde: — Uma não, duas. Durante toda a semana, eles se preparam para uma “festa da Selma”. Pesquisaram na rede as revoltas em Bangladesh, pois achavam que bloqueariam algumas refinarias, ocupariam os três prédios do poder, e o Brasil inteiro cairia aos seus pés.//////////////////////:=:http://s/ Entendo seu raciocínio. Nele, a maioria não votou em Lula, houve uma fraude. Logo, qualquer movimento colocará todo o país em estado de rebelião. ///////////////////Vale a pena estudar atentamente todos os 1.500 depoimentos dos detidos em Brasília, entrevistar longamente os líderes. Eles quebraram tudo e depois cantaram hinos religiosos. É preciso uma nova estratégia. Navegamos em mares nunca dantes navegados. Talvez reler “Os sertões” e aprender um pouco, apesar das diferenças, com algumas referências históricas. É um grande desafio, pois esperam apenas um sinal, qualquer sinal para entrar na sua terra prometida.",,,,,,,,,2,-13.5
Mediálne.sk,medialne,100063726363112,NEWS_SITE,SK,"Od roku 2004 váš obľúbený zdroj informácií o médiách, marketingu a reklame. Sme súčasťou",2009-10-07 11:11:39,14040,14070,2023-01-10 12:53:00 BRT,2023-01-10,12:53:00,Link,2,0,0,0,0,0,2,0,0,0,,-,0,0,0,N/A,https://www.facebook.com/100063726363112/posts/609525297848344,"Počas nedávnych personálnych škrtov dostali výpoveď prakticky všetci zamestnanci brazílskej pobočky spoločnosti Twitter, a to vrátane tých, ktorí sa zaoberali moderovaním obsahu",https://medialne.trend.sk/internet/demonstranti-brazilii-organizovali-internete-meta-sprisnila-kontrolu?itm_template=listing&itm_modul=articles-rubric-list&itm_position=1,https://medialne.trend.sk/internet/demonstranti-brazilii-organizovali-internete-meta-sprisnila-kontrolu,,"Odporcovia brazílskeho prezidenta sa organizovali na internete, Meta sprísnila kontrolu","Na sociálnej sieti Twitter od piatku vyše 10-tisíc účtov zdieľalo slogan Festa da Selma, pomocou ktorého sa Lulovi odporcovia zvolávali na nedeľnú demonštráciu do hlavného mesta",,,,2,-0.88
Rio de Paz,ONGRiodePaz,100064435943921,NON_PROFIT,BR,Visamos criar uma cultura de valorização da vida humana. Não temos vínculo político ou partidário. ,2009-09-30 15:16:05,28154,28976,2023-01-11 06:29:59 BRT,2023-01-11,06:29:59,Link,2,1,0,0,0,0,0,0,1,0,,-,0,0,0,N/A,https://www.facebook.com/100064435943921/posts/535448571946336,"A festa da Selma! Se os atos não eram antidemocráticos, por que usar códigos para falar do movimento em grupos de Telegram? Quem age dentro da lei não precisa se esconder de nada! Com a palavra, os golpistas. #riodepaz #ONGRiodePaz #Lula #bolsonaro #golpe #antidemocráticos #fascistas #vandalismo",https://noticias.uol.com.br/politica/ultimas-noticias/2023/01/11/mapa-online-onibus-brasilia-ato-golpista-8-janeiro-preparacao-confronto.htm,,,Preparação para ato golpista teve mapa online e previu confronto violento,"O mapa se chama ""Viagem para Praia"". Mas, em vez de pontos turísticos, estão listadas 43 cidades no Brasil onde se podia pegar ônibus para a ""festa da Selma"", com contatos dos organizadores dos transportes. A festa se refere aos atos de 8 de janeiro, q",,,,2,-30.5
Adriana Araújo,adrianaraujomg,100058161695816,PERSON,BR,Por todas as formas de vida!,2018-04-20 19:45:56,5853,6162,2023-01-15 10:21:14 BRT,2023-01-15,10:21:14,Link,1,1,0,0,0,0,0,0,0,0,,-,0,0,0,N/A,https://www.facebook.com/100058161695816/posts/583401000275285,"A LOGÍSTICA FRACASSADA do maior CRIME CONTRA A DEMOCRACIA brasileira pós redemocratização Mapa e mensagens mostram plano detalhado de bolsonaristas a golpe no dia 08/01 Bolsonaristas produziram um mapa para a logística dos transportes e se prepararam para confronto violento 11/01/2023, Jornal GGN Os crimes e a tentativa de golpe no último domingo (08) foram detalhadamente planejados pelos bolsonaristas, que produziram um mapa dos transportes de todo o Brasil, previram confronto com as polícias, recomendaram a não participação de crianças e idosos e o uso de proteção e convocaram os CACs (Caçadores, Atiradores e Colecionadores). Parte desse planejamento detalhado foi revelado em reportagem do Uol, desta quarta (11/01), que obteve acesso a um mapa online criado pelos bolsonaristas e as mensagens de Telegram com a organização. Como havia adiantado A Pública, o ato criminoso foi tratado internamente como “festa da Selma” e outras nomenclaturas foram usadas por eles para escapar de investigações. O grupo de bolsonaristas da região Sudeste se chamava “Caça e Pesca”, com 18 mil intregrantes. Nele, foram combinados detalhes de como chegar a Brasília, como agir, onde invadir e o que levar no dia 08/01.* *No mapa digital compartilhado entre eles, denominado “Viagem para Praia”, estavam marcados pontos em 43 cidades do Brasil onde se podia pegar ônibus para a invasão, com o contato dos organizadores dos transportes. ""O código é festa da Selma, vai acontecer uma festa de aniversário enorme e existe uma organização muito grande para juntar e preparar os convidados”, traz a descrição do mapa. Em outro trecho do texto do mapa, com jogo de palavras, eles informam que será empregada violência e que haverá confronto com a polícia :* “[A festa da Selma] não convidou crianças e nem idosos, quer somente adultos dispostos para participarem de todas as brincadeiras, entre elas: tiro ao alvo, polícia e ladrão, dança da cadeira, dança dos índios, pega pega, e outras.” E pedem que os bolsonaristas levem equipamentos de proteção, soro e máscara contra gás de pimenta: “É importante que cada um leve suas coisas pessoais de higienização e proteção, inclusive: máscara para não ficar ardendo com a torta de pimenta na cara e soro fisiológico para se limpar caso espirrem algo que faça vocês chorarem e lacrimejarem, mas não de alegria, durante a festa.” No grupo do Telegram, eles também recomendavam levar capa de chuva para evitar contato da pele com gás de pimenta. Todos esses itens de proteção foram usados pelos criminosos no dia 08/01. O administrador do grupo ainda compartilhou uma foto com o local da Praça dos Três Poderes, incluindo o jardim da Esplanada dos Ministérios e uma seta para o Congresso Nacional, com a mensagem: “Pessoal, o povo em massa tem que preencher todo esse espaço principalmente dentro e fora do congresso. Aí sim derruba o governo.” “Patriotas, agora é guerra. Não é manifestação pacífica (…) Cercar os 3 poderes. Brasília”, trazia outra mensagem dos organizadores. O grupo “Caça e Pesca” também dizia que os CACs foram “convocados para darem suporte aos que estão nas refinarias, distribuidoras e em frente aos 3 poderes”. No mapa “Viagem para Praia”, estavam pontuadas as refinarias e distribuidoras de combustível, também alvos do terrorismo no dia 08/01. Ao todo, o mapa traz 21 organizadores, com seus respectivos contatos, dos transportes das diferentes regiões do país para Brasília. A reportagem do Uol, que teve acesso aos dados, identificou 13 deles, nenhum deles entre os presos da lista divulgada pela Segurança do Distrito Federal, e o jornal informou que “arquivou todas as informações do mapa e as mensagens do grupo ‘Caça e Pesca'”. #FrenteAmplaPelaDemocracia #semanistia #BrasilDoFuturo #controlepopular #importanciadadenuncia",https://jornalggn.com.br/politica/plano-detalhado-de-bolsonaristas-a-golpe/,,,Mapa e mensagens mostram plano detalhado de bolsonaristas a golpe no dia 8,Bolsonaristas produziram um mapa para a logística dos transportes e se prepararam para confronto violento,,,,1,-0.93
Universidade e Democracia,universidadeedemocracia,100067752189434,UNIVERSITY,BR,"A Página reúne professores/as, estudantes e demais mobilizados/as para a defesa da Democracia e da",2016-03-22 23:26:27,10777,11178,2023-01-16 19:32:43 BRT,2023-01-16,19:32:43,Link,1,1,0,0,0,0,0,0,0,0,,-,0,0,0,N/A,https://www.facebook.com/100067752189434/posts/500790738855995,"FRANCISCO CARLOS TEIXEIRA DA SILVA Com intervenção civil, Lula adota política que tenta superar tutela militar Deserção de GSI e batalhão do Exército da 'festa da Selma' e nomeação de secretário de Dino causaram estremecimento 13.jan.2023 às 12h30 Francisco Carlos Teixeira da Silva Professor titular de história moderna e contemporânea da UFRJ (Universidade Federal do Rio de Janeiro) e professor emérito do Programa de Pós-Graduação em Ciências Militares da Eceme (Escola de Comando e Estado-Maior do Exército). Autor de ""A República Sitiada"", com Karl Schurster (no prelo), e organizador de “Dicionário de História Militar do Brasil”, entre outros livros [RESUMO] Depois do ataque de milhares de bolsonaristas às sedes dos Poderes em Brasília, setores das Forças Armadas esperavam o recurso à GLO (garantia da lei e da ordem) pelo governo Lula, o que permitiria a um general estabelecer um regime de tutela sobre a capital. A repressão dos extremistas por meio de uma inédita ""intervenção civil"" rompe com a prática usada à exaustão nos últimos anos e pode levar à superação do cacoete secular de tratar militares como responsáveis por sanear os problemas da República. Passados os primeiros momentos do grande susto de domingo (8), quando grupos bolsonaristas atacaram as icônicas sedes dos três Poderes projetadas por Oscar Niemeyer, começamos a refletir sobre a destruição do Palácio do Planalto e do Supremo Tribunal Federal e a vandalização das duas casas do Congresso. Os primeiros depoimentos dos presos começam a dar conteúdo àquilo que já sabíamos: (1) Não foi um movimento espontâneo ou uma explosão repentina de ódio que motivou os milhares de bolsonaristas; calcula-se que a mobilização reuniu 20 mil pessoas, das quais ao menos 4.000 participaram do ataque às sedes dos Poderes; (2) Houve não só uma mobilização prévia, que se valeu de meios como WhatsApp e Twitter, como uma ampla rede de suporte com pelo menos 150 ônibus que levaram, boa parte com todas as despesas previamente pagas, os extremistas a Brasília; (3) A PM do Distrito Federal fugiu de suas funções básicas quando seu contingente foi reduzido; mais que isso, uma parcela importante dos policiais do DF apoiou, por ação ou inação, a marcha até os palácios, inclusive escoltando o grupo de extremistas, com quem, em vários momentos, confraternizaram. Após instantes de perplexidade inicial, o Ministério da Justiça iniciou, ainda na noite de domingo, um decisivo processo de intervenção na Segurança Pública do DF, ordenando a desocupação dos prédios e a prisão dos invasores-depredadores. À ação do ministério, se somou uma cirúrgica intervenção do STF, por meio de decisão do ministro Alexandre Moraes, que conduz o inquérito contra atividades antidemocráticas no governo Bolsonaro. Assim, a mão pesada da Justiça, vinda do Executivo e do Judiciário, se abateu sobre o governador do DF, Ibaneis Rocha (MDB), e sobre seu (ausente) secretário de Justiça, Anderson Torres, exatamente um ex-ministro da Justiça de Bolsonaro (que estava na Flórida e, de acordo com um colunista do UOL, visitou o ex-presidente) cuja gestão foi marcada por medidas negacionistas e ameaças à democracia. Até aí, houve uma certa unanimidade, expressa na aprovação da intervenção federal no DF pelo Congresso e na confirmação, pelo plenário do STF, do afastamento do governador. Rapidamente, Ibaneis Rocha e Anderson Torres foram transformados nos ""malvados da ocasião"", a face do golpe e da manipulação perigosa das forças policiais de Brasília. No entanto, já eram visíveis algumas fissuras na unanimidade em torno das medidas contra o golpismo: além do incômodo do governador de Minas Gerais, Romeu Zema (Novo), com o afastamento do colega do DF, setores militares ligados ao Comando Militar do Planalto e o próprio comandante do Exército, Júlio Cesar de Arruda, estranharam que houvesse intervenção federal, não o recurso — transformado em lugar-comum nos governos Temer e Bolsonaro — ao instituto da GLO (garantia da lei e da ordem), conforme o artigo 142 da Constituição. Ao preferir o artigo 34 da Carta, aconselhado fortemente por alguns especialistas e com apoio de seu secretário Wadih Damous, o ministro da Justiça, Flávio Dino, descartou o recurso à força militar, amplamente utilizada antes, inclusive pelos governos do PT. No caso da intervenção no DF e da ordem de controlar e restabelecer a segurança das instituições da República, Dino se distinguiu nitidamente da prática anterior, em especial da intervenção federal no Rio de Janeiro, decretada em fevereiro de 2018, ao que se seguiu o misterioso assassinato da vereadora Marielle Franco em 14 de março, em plena intervenção comandada pelo general Braga Netto, futuro braço direito de Bolsonaro. Na verdade, os setores militares esperavam o recurso à GLO e, com isso, a indicação de um general para estabelecer um verdadeiro regime de tutela sobre a capital federal. A nomeação de Ricardo Cappelli como interventor frustrou as expectativas dos militares. (truncated)",https://www1.folha.uol.com.br/ilustrissima/2023/01/com-intervencao-civil-lula-adota-politica-que-tenta-superar-tutela-militar.shtml,,,"Opinião - Francisco Carlos Teixeira da Silva: Com intervenção civil, Lula adota política que tenta superar tutela militar",Deserção de GSI e batalhão do Exército da 'festa da Selma' e nomeação de secretário de Dino causaram estremecimento,,,,1,-20
Universidade e Democracia,universidadeedemocracia,100067752189434,UNIVERSITY,BR,"A Página reúne professores/as, estudantes e demais mobilizados/as para a defesa da Democracia e da",2016-03-22 23:26:27,10781,11180,2023-01-08 22:38:15 BRT,2023-01-08,22:38:15,Link,1,1,0,0,0,0,0,0,0,0,,-,0,0,0,N/A,https://www.facebook.com/100067752189434/posts/495627712705631,,https://apublica.org/sentinela/2023/01/bolsonaristas-usam-codigo-festa-da-selma-para-coordenar-invasao-em-brasilia/?utm_source=instagram&utm_medium=post&utm_campaign=invasao&utm_content=later-32180143,https://apublica.org/sentinela/2023/01/bolsonaristas-usam-codigo-festa-da-selma-para-coordenar-invasao-em-brasilia/,,"Bolsonaristas usam código ""Festa da Selma"" para coordenar invasão em Brasília - Agência Pública","Termo alude a cumprimento militar; chamadas para invasão do Planalto, Congresso e STF correram em redes sociais",,,,1,-21
Convoca,Convoca,821315437888933,MEDIA_NEWS_COMPANY,PE,"Hacemos periodismo de investigación, análisis de datos y apostamos por la innovación para generar cambios. Equipo ganador del Data Journalism Awards 2016.",2014-08-28 03:07:32,62940,120147,2023-01-14 18:00:01 BRT,2023-01-14,18:00:01,Link,1,0,0,0,0,1,0,0,0,0,,-,0,0,0,N/A,https://www.facebook.com/821315437888933/posts/6061286440558447,"🔎 ‘FESTA DA SELMA’: BOLSONARISTAS USAN TÉRMINO DE USO MILITAR PARA COORDINAR INVASIÓN EN BRASILIA 👉 Con este, se hicieron llamados por redes sociales, en especial Twitter, para irrumpir en Planalto, el Congreso y el Supremo Tribunal Federal. Reproducimos el informe original de Agência Pública de Brasil. https://convoca.pe/agenda-propia/festa-da-selma-bolsonaristas-usan-termino-de-uso-militar-para-coordinar-invasion-en",https://convoca.pe/agenda-propia/festa-da-selma-bolsonaristas-usan-termino-de-uso-militar-para-coordinar-invasion-en,,,‘Festa da Selma’: Bolsonaristas usan término de uso militar para coordinar invasión en Brasilia,"El término ‘Fiesta de Selma’ -en la traducción literal al español- alude al deber militar. Con este, se hicieron llamados por redes sociales para irrumpir en Planalto, el Congreso y el Supremo Tribunal Federal. Reproducimos el informe original de Agência Pública de Brasil Bruno Fonseca y La...",,,,1,-41
Convoca,Convoca,821315437888933,MEDIA_NEWS_COMPANY,PE,"Hacemos periodismo de investigación, análisis de datos y apostamos por la innovación para generar cambios. Equipo ganador del Data Journalism Awards 2016.",2014-08-28 03:07:32,62847,119323,2023-01-10 18:43:47 BRT,2023-01-10,18:43:47,Link,1,1,0,0,0,0,0,0,0,0,,-,0,0,0,N/A,https://www.facebook.com/821315437888933/posts/6048836731803418,"#Nuevo 🔎 ‘FESTA DA SELMA’: BOLSONARISTAS USAN TÉRMINO DE USO MILITAR PARA COORDINAR INVASIÓN EN BRASILIA 👉 Con este, se hicieron llamados por redes sociales, en especial Twitter, para irrumpir en Planalto, el Congreso y el Supremo Tribunal Federal. Reproducimos el informe original de Agência Pública de Brasil. https://convoca.pe/agenda-propia/festa-da-selma-bolsonaristas-usan-termino-de-uso-militar-para-coordinar-invasion-en",https://convoca.pe/agenda-propia/festa-da-selma-bolsonaristas-usan-termino-de-uso-militar-para-coordinar-invasion-en,,,‘Festa da Selma’: Bolsonaristas usan término de uso militar para coordinar invasión en Brasilia,"El término ‘Fiesta de Selma’ -en la traducción literal al español- alude al deber militar. Con este, se hicieron llamados por redes sociales para irrumpir en Planalto, el Congreso y el Supremo Tribunal Federal. Reproducimos el informe original de Agência Pública de Brasil Bruno Fonseca y La...",,,,1,-41
ITS Rio,ITSriodejaneiro,652895581417121,NON_PROFIT,BR,O Instituto de Tecnologia e Sociedade do Rio estuda o impacto e o futuro da tecnologia no Brasil e no mundo. ,2013-10-14 21:10:03,106051,106797,2023-01-16 12:01:00 BRT,2023-01-16,12:01:00,Link,1,1,0,0,0,0,0,0,0,0,,-,0,0,0,N/A,https://www.facebook.com/652895581417121/posts/8948838961822700,"O Pegabot identificou a existência de bots, no Twitter, no fim de semana marcado pela invasão ao Congresso. 🤖 🔎 Segundo as análises, descobrimos possível uso de comportamento automatizado nos posts que continham as hashtags ""Festa da Selma"", ""Selma"" e ""Supremo é o povo"", entre os dias 6 e 8 de janeiro. Quer saber mais? Confira aqui!",https://www.sbtnews.com.br/noticia/tecnologia/236330-relatorio-aponta-possivel-uso-de-bots-nas-redes-na-vespera-do-8-de-janeiro,,,Relatório aponta possível uso de bots nas redes na véspera do 8 de janeiro,ITS identificou 35% das postagens com alta probabilidade de serem de perfis de robôs,,,,1,-0.91
